{
  "schema": "subactor.observation/v1",
  "id": "biofoundry-factory-floor-observations",
  "sourceSnapshotHash": "6609be956ae98f4c3e8c2b38c464ec2796e75df2c1f6498583ecebb37050493e",
  "observations": [
    {
      "id": "obs-1",
      "observedAt": "2026-01-01T00:00:00.000Z",
      "subjectUri": "subactor://project/biofoundry-factory-floor/runtime",
      "metric": "status",
      "value": "ready",
      "severity": "info",
      "sourceUris": [
        "urn:subactor:resource:sha256:b2702750291aaca24cfcdef3dea204304167add2b58bb4b213d76eb37b2fd30a"
      ],
      "labels": [
        "bootstrap"
      ]
    },
    {
      "id": "obs-2",
      "observedAt": "2026-01-01T00:00:00.000Z",
      "subjectUri": "subactor://project/biofoundry-factory-floor/environment",
      "metric": "temperatureC",
      "value": 22,
      "unit": "mixed",
      "severity": "info",
      "sourceUris": [
        "urn:subactor:resource:sha256:a0bdaffbc342108ab527a8b37b8f3f5ea264c3a7e6fca7d294700c23bd6a2916"
      ],
      "labels": []
    },
    {
      "id": "obs-3",
      "observedAt": "2026-01-01T00:00:00.000Z",
      "subjectUri": "subactor://project/biofoundry-factory-floor/environment",
      "metric": "availability",
      "value": true,
      "unit": "mixed",
      "severity": "info",
      "sourceUris": [
        "urn:subactor:resource:sha256:a0bdaffbc342108ab527a8b37b8f3f5ea264c3a7e6fca7d294700c23bd6a2916"
      ],
      "labels": []
    }
  ]
}
