{
  "schema": "subactor.observation/v1",
  "id": "autonomy-example-observations",
  "sourceSnapshotHash": "d4ee0102d5a48e0571cd7b63a167f72ff4c8c5d70c8a88a0dd7fee274923e3c1",
  "observations": [
    {
      "id": "obs-1",
      "observedAt": "2026-01-01T00:00:00.000Z",
      "subjectUri": "subactor://project/autonomy-example/runtime",
      "metric": "status",
      "value": "ready",
      "severity": "info",
      "sourceUris": [
        "urn:subactor:resource:sha256:d47115bd8f7b695a7d70024e7423a898c10ba77d7e7b4018e719cd929ba33a5e"
      ],
      "labels": [
        "bootstrap"
      ]
    },
    {
      "id": "obs-2",
      "observedAt": "2026-01-01T00:00:00.000Z",
      "subjectUri": "subactor://project/autonomy-example/environment",
      "metric": "temperatureC",
      "value": 22,
      "unit": "mixed",
      "severity": "info",
      "sourceUris": [
        "urn:subactor:resource:sha256:f625349ef6b290ba2df48ad84f5db3ed9b49d048cbd1bb580d297a31a33d9c1c"
      ],
      "labels": []
    },
    {
      "id": "obs-3",
      "observedAt": "2026-01-01T00:00:00.000Z",
      "subjectUri": "subactor://project/autonomy-example/environment",
      "metric": "availability",
      "value": true,
      "unit": "mixed",
      "severity": "info",
      "sourceUris": [
        "urn:subactor:resource:sha256:f625349ef6b290ba2df48ad84f5db3ed9b49d048cbd1bb580d297a31a33d9c1c"
      ],
      "labels": []
    }
  ]
}
